{
  "schema_version": 1,
  "packet_id": "FSCI-P2C-007",
  "scope": "packet",
  "generated_at": "2026-10-14T08:30:00Z",
  "compatibility_envelope": {
    "scipy_version_min": "1.12.0",
    "scipy_version_max": "1.17.0",
    "known_differences": [
      {
        "version": "1.17.0",
        "description": "fsci-arrayapi implements Array API Standard 2023.12 broadcasting, reshape, transpose, and dtype promotion rules.",
        "affected_functions": ["broadcast_shapes", "broadcast_to", "reshape", "transpose", "astype"]
      }
    ]
  },
  "threats": [
    {
      "threat_id": "THREAT-001",
      "subsystem": "fsci-arrayapi",
      "category": "malformed_input",
      "severity": "high",
      "likelihood": "likely",
      "description": "Incompatible array shapes passed to broadcast_shapes or broadcast_to cause invalid stride indexing.",
      "mitigation": "Defended in crates/fsci-arrayapi/src/broadcast.rs:6 (broadcast_shapes): validates right-aligned dimension compatibility and rejects mismatched axes with ArrayApiError::BroadcastError.",
      "test_reference": "broadcast_to_rank2_singletons_preserves_row_major_values",
      "strict_mode_response": "Return Err(ArrayApiError::BroadcastError) matching Array API specification.",
      "hardened_mode_response": "Reject incompatible shapes fail-closed and record AuditAction::FailClosed in AuditLedger."
    },
    {
      "threat_id": "THREAT-002",
      "subsystem": "fsci-arrayapi",
      "category": "resource_exhaustion",
      "severity": "high",
      "likelihood": "possible",
      "description": "Shape product overflow or element-count mismatch during reshape or full array allocation.",
      "mitigation": "Defended in crates/fsci-arrayapi/src/backend.rs:102 (reshape): checks checked_mul element counts and rejects element-count mismatches before allocation.",
      "test_reference": "from_slice_reshape_and_transpose_round_trip",
      "strict_mode_response": "Return Err(ArrayApiError::InvalidShape) when element counts differ.",
      "hardened_mode_response": "Reject overflow or mismatched shape fail-closed with audit event."
    },
    {
      "threat_id": "THREAT-003",
      "subsystem": "fsci-arrayapi",
      "category": "numerical_instability",
      "severity": "medium",
      "likelihood": "possible",
      "description": "Lossy or non-finite scalar conversions during astype casting across numeric dtypes.",
      "mitigation": "Defended in crates/fsci-arrayapi/src/backend.rs:90 (astype): validates target dtype promotion rules and checks finiteness in Hardened mode.",
      "test_reference": "array_accessors_and_creation_flow",
      "strict_mode_response": "Follow standard IEEE / Rust numeric cast semantics.",
      "hardened_mode_response": "Reject non-finite values when casting to integer dtypes and emit FailClosed audit event."
    },
    {
      "threat_id": "THREAT-004",
      "subsystem": "fsci-arrayapi",
      "category": "compatibility_drift",
      "severity": "medium",
      "likelihood": "possible",
      "description": "Out-of-bounds slice indices or negative step slicing diverging between Strict clamping and Hardened rejection.",
      "mitigation": "Defended in crates/fsci-arrayapi/src/audit.rs:93 (record_fail_closed): enforces explicit Strict clamping vs Hardened fail-closed bounds checking on slice descriptors.",
      "test_reference": "strict_vs_hardened_slice_bounds_behavior",
      "strict_mode_response": "Clamp slice bounds to [0, dim] matching Python/NumPy slice semantics.",
      "hardened_mode_response": "Reject out-of-bounds slice indices fail-closed and emit FailClosed audit entry."
    }
  ],
  "fail_closed_policies": [
    {
      "input_class": "incompatible broadcast shapes",
      "policy": "reject",
      "strict_mode_action": "Return ArrayApiError::BroadcastError.",
      "hardened_mode_action": "Return ArrayApiError::BroadcastError and record FailClosed in AuditLedger."
    },
    {
      "input_class": "reshape element-count mismatch or overflow",
      "policy": "reject_with_diagnostics",
      "strict_mode_action": "Return ArrayApiError::InvalidShape.",
      "hardened_mode_action": "Return ArrayApiError::InvalidShape and emit FailClosed audit event."
    },
    {
      "input_class": "out-of-bounds slice bounds in Hardened mode",
      "policy": "reject_with_diagnostics",
      "strict_mode_action": "Clamp to axis extent per Array API standard.",
      "hardened_mode_action": "Reject out-of-bounds slice with ArrayApiError::IndexOutOfBounds."
    },
    {
      "input_class": "invalid permutation axes in transpose",
      "policy": "reject",
      "strict_mode_action": "Return ArrayApiError::InvalidAxis.",
      "hardened_mode_action": "Return ArrayApiError::InvalidAxis and record FailClosed event."
    }
  ]
}
