{
  "schema_version": 1,
  "packet_id": "FSCI-P2C-004",
  "scope": "packet",
  "generated_at": "2026-10-14T08:30:00Z",
  "compatibility_envelope": {
    "scipy_version_min": "1.12.0",
    "scipy_version_max": "1.17.0",
    "known_differences": [
      {
        "version": "1.17.0",
        "description": "GMRES uses adaptive inner restart tolerance and LGMRES guards against k=0 lucky breakdown.",
        "affected_functions": ["spsolve", "gmres", "lgmres", "eigsh", "eigs"]
      }
    ]
  },
  "threats": [
    {
      "threat_id": "THREAT-001",
      "subsystem": "fsci-sparse",
      "category": "numerical_instability",
      "severity": "critical",
      "likelihood": "likely",
      "description": "GMRES stagnation across restarts when inner Krylov tolerance is loose relative to outer residual norm.",
      "mitigation": "Defended in crates/fsci-sparse/src/linalg.rs:9480 (gmres): tightens inner Arnoldi tolerance adaptively across restarts and verifies true residual ||b - Ax||.",
      "test_reference": "FSCI-P2C-004_sparse_ops.json::spmv_csr_general_3x3",
      "strict_mode_response": "Run restarted GMRES with true-residual check and return converged flag matching SciPy.",
      "hardened_mode_response": "Reject non-finite matrix or RHS inputs fail-closed and record audit event."
    },
    {
      "threat_id": "THREAT-002",
      "subsystem": "fsci-sparse",
      "category": "malformed_input",
      "severity": "high",
      "likelihood": "likely",
      "description": "Corrupted CSR/CSC indptr or out-of-bounds column/row indices passed to sparse constructors or solvers.",
      "mitigation": "Defended in crates/fsci-sparse/src/linalg.rs:5861 (spsolve): validates sparse structure invariants, square dimensions, and RHS length before factorization.",
      "test_reference": "diags_rejects_length_mismatch",
      "strict_mode_response": "Return Err(SparseError) on structural or shape mismatch.",
      "hardened_mode_response": "Reject malformed structure fail-closed and emit AuditAction::FailClosed."
    },
    {
      "threat_id": "THREAT-003",
      "subsystem": "fsci-sparse",
      "category": "resource_exhaustion",
      "severity": "high",
      "likelihood": "possible",
      "description": "LGMRES lucky breakdown at k=0 or non-convergent Krylov iterations spinning indefinitely.",
      "mitigation": "Defended in crates/fsci-sparse/src/linalg.rs:9867 (lgmres): detects happy breakdown in Arnoldi step and enforces outer maxiter cap.",
      "test_reference": "audit_fingerprints_cover_every_input",
      "strict_mode_response": "Terminate cleanly on breakdown or maxiter limit.",
      "hardened_mode_response": "Enforce iteration cap and emit structured convergence diagnostics."
    },
    {
      "threat_id": "THREAT-004",
      "subsystem": "fsci-sparse",
      "category": "compatibility_drift",
      "severity": "medium",
      "likelihood": "possible",
      "description": "Negative-weight cycles in shortest-path graph algorithms or disconnected graph components.",
      "mitigation": "Defended in crates/fsci-sparse/src/linalg.rs:38974 (dijkstra): rejects negative edge weights in Dijkstra and delegates signed graphs to Bellman-Ford.",
      "test_reference": "eye_constructs_expected_identity",
      "strict_mode_response": "Return SparseError on negative edge weight in Dijkstra matching SciPy csgraph.",
      "hardened_mode_response": "Validate graph adjacency finiteness and symmetry invariants."
    }
  ],
  "fail_closed_policies": [
    {
      "input_class": "non-monotonic indptr or out-of-bounds indices",
      "policy": "reject_with_diagnostics",
      "strict_mode_action": "Return SparseError::InvalidStructure on construction.",
      "hardened_mode_action": "Reject fail-closed and record AuditAction::FailClosed in ledger."
    },
    {
      "input_class": "singular sparse matrix in spsolve/splu",
      "policy": "reject_with_diagnostics",
      "strict_mode_action": "Return SparseError::SingularMatrix.",
      "hardened_mode_action": "Return SparseError::SingularMatrix or fallback via SparseSolverPortfolio."
    },
    {
      "input_class": "non-finite sparse data or RHS",
      "policy": "reject",
      "strict_mode_action": "Reject when check_finite or Hardened mode is active.",
      "hardened_mode_action": "Reject unconditionally with SparseError::NonFiniteInput."
    },
    {
      "input_class": "incompatible matrix/vector shapes",
      "policy": "reject",
      "strict_mode_action": "Return SparseError::IncompatibleShape.",
      "hardened_mode_action": "Return SparseError::IncompatibleShape with audit record."
    }
  ]
}
